dimension,high,low
power distance,respect father master servant brother yonger older wisdom favor protect obey orders pleasing,rights complain negotiate fairness task necessity codetermination objectives question critisize
individualism,self friendship contract litigation self-interest self-respect self-actualizing individual dignity I me pleasure adventure guilt privacy,we harmony face obligation sacrifice family tradition decency honor duty loyalty shame
masculinity,career competition fight aggressive success winner deserve merit excel force big fast tough hard quantity total power action,qulity caring solidarity modesty compromise help love grow small soft slow tender touch
uncertainty avoidance,structure duty truth law order certain pure clear secure safe predictable tight,maybe creative conflict tolerant experiment spontaneous relativity insight unstructured loose flexible
long-term orientation,work safe moderation endurance duty goal permanent future economy virtue invest afford effort,relation gift today yesterday quick spend receive grand tradition show image bottom-line
indulgence,leasure happy loose freedom tolerance acceptance soft-punishments,work tight moral severe-punishments rules strict intolerance